{"apiVersion":"kernel-zero.dev/v1","kind":"WorkflowPolicy","metadata":{"description":"GitHub Actions workflow hygiene rules","name":"workflow-hygiene","revision":1},"rules":[{"check":{"kind":"pinned-actions","mode":"sha"},"id":"pinned-actions","level":"error","remediation":"Pin every action reference to a commit sha.","title":"Actions are pinned"},{"check":{"allowWrite":["contents"],"kind":"restricted-permissions"},"id":"least-privilege-permissions","level":"error","remediation":"Declare top-level permissions and grant write only where the policy allows it.","title":"Least-privilege permissions"}],"scope":{"include":[".github/workflows/*.yml",".github/workflows/*.yaml"]}}
